ID,Title
133,"The Ricoh GR III is a pocketable, lightweight camera with a newly designed 28mm equiv. F2.8 lens and 24MP APS-C sensor. It features a sensor-shift shake reduction system (which can also be used for simulating the effect of an anti-aliasing filter) along with a hybrid autofocus system. It has a 3"" touchscreen display (with support for an optical viewfinder), hot shoe, USB-C port with video output and built-in Wi-Fi plus Bluetooth. The GR III can capture video at Full HD video at 60 fps. The Ricoh GR III updates the GR series in some really important ways, bringing a modern high-resolution sensor and hybrid autofocus system to the lineup for the first time. Controls have been simplified, and a new touch-sensitive rear screen makes autofocus positioning and image navigation much faster. Image quality is excellent, although JPEG shooters might find that the 'Std' profile delivers rather dull results. The lack of a flash, and unimpressive battery performance are the only major black marks against this pocketable camera. Good for: Street shooting and casual photography, or travel photography where a small and light camera, with a medium-wide lens is very useful. Not so good for: Any work that requires long shooting sessions, long focal lengths, or low light shooting, where the GR III's autofocus system can struggle."
134,"The GoPro Hero7 Black was introduced alongside Silver and White Hero7 versions, and of the three cameras the Black offers the highest specifications. It records 4K/60p and 2.7K/120p video, as well as 1080p at up to 240 fps. It captures 12MP stills and unlike the Silver and White versions, uses a removable battery rather than built-in. The Hero7 Black also offers the first generation of the company's HyperSmooth digital image stabilization."
135,"The GoPro Hero 7 Silver launched alongside the higher-spec'd Black and budget-oriented White editions. The Hero 7 Silver features 4K/30p video recording, built-in GPS and 10MP stills. It uses a built-in rather than removable lithium-ion battery, and lacks the super slow-motion video modes offered by the Hero 7 Black."
136,"The GoPro Hero 7 White is a budget-friendly action cam that launched alongside the higher-spec'd Black and Silver editions. The Hero 7 White offers a more pared-down feature set including 1080/60p video recording, Wi-Fi + Bluetooth and 10MP stills. It uses a built-in rather than removable lithium-ion battery, and lacks the built-in GPS offered by the Black and Silver Hero 7s."
137,"The Canon PowerShot SX70 HS is a super-zoom point-and-shoot camera with a 65x, 21-1365mm equivalent F3.4-6.5 lens and 20MP BSI-CMOS sensor. The camera is powered by Canon's latest Digic 8 processor which allows for fast bursts and 4K video capture. As you'd expect, its long lens is stabilized, with up to five stops of shake reduction. Photos can be composed on a fully articulating 3"" display or a high-res OLED electronic viewfinder. The SX70 is Canon's first point & shoot camera to support its new CR3 Raw format. The SX70 can shoot continuously at 10 fps with single AF and 5.7 fps with continuous AF.  UHD 4K video can be captured at 30 fps, and a high speed 120 fps mode is available at Full HD resolution. Wireless connectivity includes Wi-Fi and Bluetooth."
138,"The Fujifilm X-T3 is an enthusiast SLR-style mirrorless camera with a new 26MP BSI CMOS X-Trans sensor and updated hybrid AF system with 425 phase-detect points and nearly 100% coverage. The camera has the same analog controls for shutter speed, ISO and exposure compensation as the X-T2 before it, and nine buttons and dials are customizable. The X-T3 has a 3.69M-dot electronic viewfinder with a large 0.75x magnification as well as a touchscreen LCD that tilts on two axes. The tough magnesium-alloy body is sealed against dust and moisture and features twoSD cards that support UHS-II media. The camera shoots continuously at 20 fps (e-shutter) or 11 fps (mechanical shutter) at full resolution, or up to 30 fps in a 1.25x crop mode. Video can be captured at both DCI and UHD 4K at up to 60p, with a top bit rate of 400Mbps. The camera supports the H.265 codec and can output 10-bit video at 4:2:2 over HDMI, or record internal 10-bit at 4:2:0. Both F-Log and HLG are supported. Note that there is an ""X-T3 WW"" model that does not include a charger but costs $100 less. As a stills camera the X-T3 is a pleasant update to one of our favorite APS-C cameras, significantly improving the autofocus. If you're interested in stills and video, though, it's knockout. The lack of stabilization holds the video back a touch but as a compact, relatively affordable do-everything camera, it's impressive. Good for: A bit of everything, especially if that everything includes video. Not so good for: Sports shooting at the highest levels."
139,"The EOS R is Canon's first full-frame mirrorless camera. It features a 30.3MP CMOS sensor with Dual Pixel AF and an ISO range of 100-40000 (expandable to 50-102400). The EOS R can record both 14-bit (CRW) and compressed (C-RAW) formats. It can shoot continuously at 8 fps in single AF and 5 fps with continuous AF. The Dual Pixel AF system has a whopping 5655 selectable AF points and it can function at light levels as low as -6EV. The compact body has a 3.69M-dot OLED electronic viewfinder with a 0.76x magnification, as well as a 3.2"", 2.1M-dot fully-articulating touchscreen LCD. On the top plate is an OLED panel that displays current shooting information. The EOS R offers Mini-HDMI and USB-C ports, as well as a 3.5mm external mic socket. Battery life is CIPA-rated at 370 shots per charge (450 using Power Saving mode). A battery grip is available. The EOS R has a single memory card slot that supports UHS-II media. 4K UHD video can be captured at up to 29.97 fps using ALL-I or IBP compression with a max bit rate of 480MBps. If you want 60p video you'll have to drop down to Full HD. With a 30MP sensor, fantastic color reproduction and on-sensor autofocus, the EOS R can produce some beautiful photographs with pinpoint-accurate focus. But it's Canon's first mirrorless full-frame camera, and in many ways, it shows. The ergonomics feel unfinished, and for the same or less money, you can find better video, more dynamic range and faster burst speeds elsewhere. But we have to admit that Canon's new RF lenses are simply spectacular, and at this time, the EOS R is the only way to get to use them. Good for: General and social photography, casual video shooters and those looking for either a backup body for their full-frame Canon glass or are looking at building up a collection of new RF lenses. Not so good for: Those looking to shoot sports or fast-moving subjects, those needing the absolute best image quality for either landscape or video work."
140,"At the time of its launch, the Sony Cyber-shot HX99 and its HX95 sibling are the smallest travel zoom compacts in the world. Like the HX95, the HX99 packs a 28x zoom 24-720mm equivalent lens, 18MP 1/2.3"" sensor, 180-degree tilting 3.0"" screen and 4K/30p video with full pixel readout. The cameras also include a front-end LSI and BIONZ X processor, making possible 10 fps shooting with a 155 image buffer. The HX99 offers a couple of additional features: touchscreen functionality and a customizable control ring around its lens."
141,"At the time of its launch, the Sony Cyber-shot HX95 and its HX99 sibling are the smallest travel zoom compacts in the world. Like the HX99, the HX95 packs a 28x zoom 24-720mm equivalent lens, 18MP 1/2.3"" sensor, 180-degree tilting 3.0"" screen and 4K/30p video with full pixel readout. The cameras also include a front-end LSI and BIONZ X processor, making possible 10 fps shooting with a 155 image buffer. The HX95 lacks the 99's touchscreen functionality and a customizable control ring around its lens."
142,"The Nikon D3500 is the company's entry-level DSLR camera. It's essentially the same as its predecessor, the D3400, except that it now uses the same body as the D5600. It continues to have a 24MP APS-C CMOS sensor, EXPEED 4 image processor, Full HD video capture and an easy-to-use interface. The camera has an ISO range of 100-25600, an 11-point autofocus system and can shoot continuously at 5 fps. The camera's Guide Mode makes it easy to learn how to shoot in various situations. While it doesn't have Wi-Fi, the D3400 has Bluetooth connectivity for transferring images from the camera to a smartphone, albeit slowly. The D3500 is a compact and likeable DSLR for beginners. It's not great for video and its image transfer is slow. But for stills it's a solid choiceand its Guide Mode makes it easy to learn. Good for: Beginners who want the DSLR experience Not so good for: Video shooters or anyone expecting a phone-like 'WYSIWYG' shooting experience."
143,"The Nikon Z 7 is the company's high-end full-frame mirrorless camera. It features a 45.7MP BSI-CMOS sensor, a hybrid AF system with 493 points and 90% coverage and 5-axis in-body image stabilization. The rugged body is similar in design to the D850 DSLR and is fully sealed against dust and moisture. It features a 3.68M-dot electronic viewfinder and tilting 3.2"", 2.1M-dot touchscreen LCD. An OLED panel on the top plate displays current shooting settings. Photos are stored on an XQD card. The Z 7 can shoot continuously at 9 fps with AE locked and 5.5 fps with continuous AF/AE. The buffer is relatively small, topping out at 18-23 Raw and 25 JPEG images. It can capture 4K video using the full width of the sensor, or users can switch to a DX crop mode where the entire sensor is sampled. You can use the same features for videos as you can for stills, including 5-axis IS and the hybrid AF system (with 435 points here). The Z 7 supports focus peaking, zebra patterns, time code and 10-bit Log output over HDMI. The camera can record 8-bit video internally and externally at the same time.  Connectivity options include Wi-Fi (802.11ac) with Bluetooth as well as the ability to connect directly to a PC. The Nikon Z7 is an extremely well-rounded digital camera and suitable for a wide range of photographic and video needs. It packs outstanding image quality and very good 4K video in a lightweight, well-built package with in-body image stabilization. Autofocus is less reliable than the competition and the buffer can be limiting for fast action, but overall, the Z7 is a pleasure to shoot with. Good for: Hybrid stills and video shooters, photographers looking for a versatile tool for a wide range of subjects in a compact package. Not so good for: Those needing class-leading autofocus performance, faster burst rates, or greater buffer depth."
144,"The Nikon Z6 is the company's midrange full-frame mirrorless camera. It features a 24.5MP BSI-CMOS sensor, a hybrid AF system with 273 points and 90% coverage and 5-axis in-body image stabilization. The rugged body is similar in design to the D750/D850 DSLRs and is fully sealed against dust and moisture. It features a 3.68M-dot electronic viewfinder and tilting 3.2"", 2.1M-dot touchscreen LCD. An OLED panel on the top plate displays current shooting settings. Photos are stored on an XQD card. The Z6 can shoot continuously at 12 fps with AE locked and 5.5 fps with continuous AF/AE. It can capture oversampled 4K video for maximum resolution. You can use the same features for videos as you can for stills, including 5-axis IS and the hybrid AF system (with 435 points here). The Z6 supports focus peaking, zebra patterns, time code and 10-bit Log output over HDMI. The camera can record 8-bit video internally and externally at the same time.  Connectivity options include Wi-Fi (802.11ac) with Bluetooth as well as the ability to connect directly to a PC. The Nikon Z6 is a well-built full-frame mirrorless camera that produces excellent stills and 4K video. Autofocus is reliable most of the time, including during burst shooting, though selecting a subject on which to track is clumsy. The camera's built-in image stabilization works well on native and 'classic' Nikon glass. Battery life isn't class-leading, and some improvements related to manual focus in video should be addressed, but overall Nikon has a winner in the Z6. Good for: Everyday shooting, video Not so good for: Sports and action"
145,"The Panasonic DC-LX100 II is an enthusiast compact with a 17MP Four Thirds sensor that allows the camera to maintain the same field-of-view at 16:9, 3:2 and 4:3 aspect ratios. The LX100 II uses the same 24-75mm equivalent F1.7-2.8 Leica DC lens and shares the same design, including dials for shutter speed and exposure compensation, plus a ring for adjusting the aperture. A custom control ring can also be found around the lens. The LX100 II has a 1.24M-dot touchscreen LCD and 2.76M-dot equivalent electronic viewfinder.  The camera can shoot continuously at 5.5 fps with continuous autofocus or 11 fps with AE/AF lock. As before, the LX100 II can capture UHD 4K video, which also allows for 4K Photo, Post Focus and Sequence Composition features. It has Panasonic's latest Picture Styles, including the high-contrast L.Monochrome D mode, to which a random grain effect can be added. The LX100 II has built-in Wi-Fi and Bluetooth, with the latter maintaining a constant connection that allows for quick remote control and auto image transfer. The LX100 II is a small, engaging enthusiast compact. Its bright 24-75mm equivalent lens and multi-aspect design make it highly flexible. Only the cropped video and slightly basic viewfinder stop this lightly-refreshed camera reasserting itself as a clear leader in this class. Good for: Enthusiasts looking for an enjoyable always-with-them tool Not so good for: Anyone needing something truly pocketable"
146,"Leica's M10-P is the more expensive sibling to the M10. The differences between the M10-P and M10 include the lack of a 'red dot' on the front as well as the addition of a touchscreen LCD, electronic level and quieter shutter mechanism. The M10 comes with a 24MP sensor with a top ISO of 50000. The Maestro II processor has 2GB of buffer to provide 30 Raw images or 100 JPEG images to be captured at 5 fps. The M10-P has some degree of environmental sealing and lacks any I/O ports. It does have Wi-Fi support, however."
147,"The PowerShot SX740 HS is an ultra-compact camera with a long 40x zoom lens. The optically stabilized lens has an equivalent focal length of 24-960mm and is paired with a 20.3MP BSI CMOS sensor and Canon's DIGIC 8 processor. It has a 3"" LCD that can flip upward 180 degrees for self-portraits, a useful Zoom Framing Assist feature for recomposing at long focal lengths, 4K/30p video and time-lapses, plus Wi-Fi and Bluetooth connectivity."
148,"The Fujifilm XF10 is an enthusiast compact with a 24MP APS-C-size CMOS sensor and 28mm equiv. F2.8 lens. It has a 91-point hybrid autofocus system, 6 fps burst shooting and 4K/15p video capture. The body has twin control dials, a fixed 3"" touchscreen LCD, a built-in flash and a socket for an external microphone. The Fujifilm XF10 takes great photographs and looks great doing it, but has too many caveats for us to wholeheartedly recommend. Overall operation is sluggish and autofocus just isn't reliable, which is unforgivable at this point considering how capable smartphones have become. But the lens is sharp, the sensor excellent and the colors gorgeous. In short, the XF10 can provide you with beautiful results, but you better pack your patience. Good for: Street photographers using 'snap focus', landscape shooters looking for a lightweight photographic companion and generalist photographers that have enough experience to work around the camera's limitations. Not so good for: Shooters that require consistently accurate autofocus, those looking to capture unexpected decisive moments and those who already have the latest smartphones that - in most cases - will be good enough."
149,"The Sony Cyber-shot DSC-RX100 Mark VA is an updated version of the fifth camera in Sony's popular lineup of 1"" enthusiast compacts. The ' VA' model gains a deeper buffer, new white balance, metering and autofocus options, and the ability to save 720p proxy footage along with 4K video. Support for Sony's PlayMemories Apps has been removed. Features that carryover include on-sensor phase detection AF and a burst rate of 24 fps with full-time focusing. The AF system has the same 25-pt contrast-detect system with 315 PDAF points that cover 65% of the frame. 4K video is oversampled without pixel binning and saved using the XAVC S codec. The RX100 V(A) continues to offer a 20.1MP 1""-type stacked CMOS sensor, 24-70mm F1.8-2.8 lens, pop-up EVF and built-in Wi-Fi w/NFC."
150,"The Nikon Coolpix P1000 superzoom camera has, as of July 2018, the world's longest lens, coming in at 24-3000mm equivalent with a maximum aperture range of F2.8 - F8. The lens features 1 Super ED and 5 ED elements as well as an image stabilization system that reduces shake by up to 5 stops. With the lens extended the camera is 181mm / 7.2"" long and it weights 1.4kg / 3.1 lbs. The camera has a hot shoe as well as flash sync port. The P1000 uses a 16MP, 1/2.3"" CMOS sensor with an ISO range of 100-6400 and Raw support. Photos can be composed on a 3.2"" fully articulating LCD (not touch-enabled) or a 2.36M-dot OLED viewfinder. Video can be captured at UHD 4K/30p and 1080/60p (as well as several high speed modes) with manual exposure and clean HDMI output. Wireless features include Wi-Fi and Bluetooth. The Nikon Coolpix P1000 is all about its incredible zoom range. If you need a focal length of 3000mm, it's the only game in town. If you don't need that much zoom then there are far better cameras for equal or less money. Good for: Capturing the moon and still wildlife from incredible distances. Not so good for: High image quality for most situations, focusing on moving subjects,  a long day of shooting"
151,"The Leica C-Lux is a rebadged version of the Panasonic Lumix DC-ZS200/TZ200. It's 20MP 1""-sensor compact with a 24-360mm equiv. F3.3-6.4 lens, 3"" touchscreen, and a 2.3 million-dot EVF with 0.53x magnification.  Contrast detect autofocus is aided by Panasonic's very good Depth from Defocus technology, and up to 10 fps burst shooting is available with AF-S (6 fps in AF-C). Rounding out a travel-friendly feature set are 4K video, Wi-Fi with Bluetooth, and 5-axis optical+electronic image stabilization."
152,"The Cyber-shot RX100 VI is a 1""-type compact camera with a 24-200mm F2.8-4.5 zoom lens, 315 phase detection points and the ability to shoot at 24 fps with autofocus. It's the first in the Cyber-shot RX100-series to offer a touchscreen, allowing both touch shutter and touch focus. The screen can tilt up to 180 degree upwards and 90 degree downwards, extending shooting flexibility.  The Mark VI includes the latest Bionz X processor with front-end LSI, helping give what the company says is the world's fastest AF (measured at 0.03 seconds) and with twice the EyeAF tracking performance of the Mark V. The new 24-200mm zoom lens offers a claimed 4EV of image stabilization. The RX100 VI is a very capable camera, combining a flexible zoom range with impressive autofocus. However, the small maximum aperture required to keep the size down limits the image quality in some situations. The relatively high price means you have to really want its unequaled combination of capability and size. Good for: Anyone needing fast AF, good video, sharp images and a flexible zoom range in a pocket-sized package. Not so good for: Anyone seeking the best possible image quality in dim light or with moving subjects."
153,"The Fujifilm X-T100 is a midrange SLR-styled mirrorless camera. Largely based on the entry-level X-A5, the X-T100 has a fully articulating (rather than tilting) touchscreen and also borrows a good-sized OLED EVF from the X-T20. It has a 24MP CMOS sensor, a hybrid autofocus system with 91 phase-detect points, Fujifilm's well-liked Film Simulation modes and 4K/15p video capture. The X-T100 is equipped with Wi-Fi and Bluetooth for easy photo sharing. The Fujifilm X-T100 is a SLR-style mirrorless camera with excellent photo quality plus a unique articulating LCD, high-res viewfinder and great battery life. However, its autofocus subject tracking abilities are disappointing, with only 15 fps recording at 4K and overall poor video quality. Good for: Travel, portrait and landscape photographers who want excellent image quality, an articulating LCD and top-notch selection of lenses. Not so good for: Capturing anything moving or recording video. Shooting bursts of Raw images."
154,"The Panasonic Lumix DC-TS7 (known as the FT7 outside of North America) is the first compact rugged camera to feature an electronic viewfinder (as of May 2018). The camera is waterproof to 31m/102ft, shockproof to 2m/6.6ft, pressure resistant to 100kgf/220lbf and freezeproof to 10°C/-14°F. It pairs a 20.4MP BSI-CMOS with a optically stabilized 28-128mm equivalent F3.3-5.9 lens. The main attraction is a 0.2"" electronic viewfinder with 1.17M-dot equivalent viewfinder for shooting outdoors. There's also a 3"" LCD display with 1.04 milliion dots. The camera can record 4K video at 24p or 30p and has a high speed 120 fps mode, albeit at 1280 x 720. Wi-Fi is built in, though the TS7 doesn't offer Bluetooth like many other modern Panasonic cameras. Battery life in rated at a respectable 300 shots per charge."
155,"The Sony a7 III is a 24MP full frame mirrorless camera that incorporates many of the features and improvements found in the a7R III. Primary among these are a BSI sensor, along with the larger capacity 'Z' battery, AF joystick and the company's impressive EyeAF feature. Its 693-point AF system offers 93% frame coverage. Continuous shooting is offered at up to 10 fps with mechanical shutter, and 5-axis in-body stabilization claims a 5.0 stop shutter speed advantage. Video recorded at 4K/24p is taken from a 6K region of the sensor, while 30p shooting comes from a roughly 5K region with a 1.2x crop. The camera offers both S-Log2 and S-Log3 gamma curves for shooting wide dynamic range scenes or Hybrid Log Gamma for playing back directly on high dynamic range displays.  The new larger-capacity battery boasts 710 shots per charge. The a7 III uses the same 2.36m dot OLED viewfinder as its predecessor, giving a 1024 x 768 pixel view, rather than the higher-res version in the a7R III. The viewfinder is complemented by an articulated 3"" 921k-dot LCD. The Sony a7 III is a well-priced, well-rounded camera suitable for all kinds of photography. Twenty-four megapixels of resolution is more than sufficient for most tasks, and the 693-point autofocus system and 10 frames-per-second burst speed help the a7 III keep up with fast action. Video quality and feature set is another strong point, though some operational lag, a slightly low-resolution viewfinder and unintuitive video autofocus may turn off some users. Good for: Generalist photographers, wedding, event and action shooters and those that need high quality video. Not so good for: Those that need more resolution for detailed scenes or large prints, those that need ultimate build quality for harsh shooting conditions."
156,"The Canon EOS M50 is a midrange mirrorless camera with a 24MP APS-C CMOS sensor, DIGIC 8 processor and Dual Pixel AF. With select lenses it offers Dual Pixel coverage of 88% x 100% and 143 AF points, with other lenses offering 80% x 80% coverage and 99 AF points. The M50 is the first Canon camera to use the CR3 Raw format, allowing for up to 50% smaller file sizes. The M50 is capable of taking burst at 7.4 fps with continuous autofocus for up to 10 Raw or 47 JPEGs. The M50 has a fully articulating 3"" touchscreen LCD with 1.04 million dots as well as an OLED electronic viewfinder with 2.36M dots. It can record 4K UHD video at 30p, albeit with a substantial crop and no Dual Pixel AF. Connectivity options include Wi-Fi and Bluetooth. As a stills camera, the EOS M50 is a solid choice for photographers who want something more advanced than an entry-level camera, without going overboard. Its image quality, improved AF system and wireless connectivity are all impressive, and the new C-Raw format is a nice bonus. If 4K video is what you're after, the M50 is not the camera for you due to its high crop factor, rolling shutter and mediocre AF performance. Good for: People on the go who want something compact, with good connectivity and an accessible interface. Not so good for: Anyone interested in 4K video capture. Those without easy access to a power outlet and don't want to carry a pocket full of batteries."
157,"The Canon EOS Rebel T7 (also known as the EOS 2000D) is a budget-friendly DSLR with an 24MP APS-C-size sensor. It uses Canon's DIGIC 4+ image processor which offers an ISO range of 100-6400, expandable to 12800, as well as 3p fps burst shooting. It features a 9-point AF system with a cross-type sensor at the center. The EOS T7 is also features with a 3-inch, 920,000-dot LCD and, of course, an optical viewfinder. It also offers a host of scene modes, including a Scene Intelligent Auto mode, plus numerous creative filters. Full HD can be captured at 30p or 24p. The Rebel T7 also has Wi-Fi with NFC for easy sharing via Canon's Camera Connect app."
158,"The Canon EOS 4000D is the most budget-friendly Canon DSLR and features an 18MP APS-C-size sensor. It uses Canon's DIGIC 4+ image processor which offers an ISO range of 100-6400, expandable to 12800, as well as 3 fps burst shooting. It features a 9-point AF system with a cross-type sensor at the center. The 4000d uses a 2.7-inch, 230,000-dot LCD or, of course, an optical viewfinder. It features a host of scene modes, including a Scene Intelligent Auto mode, plus numerous creative filters. Full HD can be captured at 30p, 25 or 24p. The 4000D also has Wi-Fi  for sharing images via Canon's Camera Connect app."
