ID,Title
1,"The Leica Q3 updates its predecessor with a higher resolution 60MP full-frame sensor, improved burst rates and the added the ability to shoot 8K/30p video. The camera brings back the stabilized 28mm F1.7 offered since the Q1."
2,"The Fujifilm X-S20 is a DSLR-style mirrorless camera with a 26MP X-Trans BSI-CMOS sensor. Unlike other Fujifilm X-series cameras, it has a more traditional control layout and a larger grip. It uses the same sensor as the X-T4 and X-S20 with upgrades to the image stabilization system, processor, and AF system. The camera can shoot bursts at 30 fps with a crop, 20 fps without using the electronic shutter, or 8 fps with the mechanical shutter and can sustain bursts longer thanks to its UHS-II card slot and faster processor.  The camera has a mode dial rather than the shutter speed and exposure compensation dials found on other X-series models. It also has a pop-up flash. The built-in OLED viewfinder has a magnification of 0.62x and resolution of 2.36 million dots. The LCD is fully articulating and touch-enabled. A mic input is built in, and headphones can be used using the 3.5mm jack on the grip. The camera can be powered over its USB port. The camera can capture 6K open gate footage, 4K (DCI and UHD) for more than 30 minutes, with more runtime if you add the FAN-001 cooling fan accessory. Lovers of high-speed video can shoot at up to 240 fps by dropping down to Full HD. The X-S20 supports F-Log and F-Log2, 10-bit 4:2:2 internal recording, and compatibility with Blackmagic RAW and ProRes RAW using an external recorder."
3,The Canon EOS R100 camera is an entry level 24MP APC-C mirrorless hybrid camera for the RF-mount system.
4,The Sony ZV-1 Mark II is a vlogging compact built around a 20MP Type 1 (13.2 x 8.8mm) Stacked CMOS sensor and an 18-50mm equivalent F1.8-4.0 lens.
5,
6,
7,
8,"The Pentax K-3 Mark III Monochrome is a black-and-white only version of the company's mid-sized enthusiast DSLR. It features a 25.7MP BSI-CMOS sensor, in-body image stabilization, and an all-new optical viewfinder. The viewfinder offers a large 0.7x (equivalent) magnification and has composition and shooting data on a transparent panel. The camera has a fixed 3.2"" touchscreen with 1.62 million dots. The camera uses the 'Safox 13' autofocus system with 101 points, 25 of which being cross-type. It can shoot bursts at 12 fps (11 fps with continuous AF). It offers both Pixel Shift Resolution and Anti-aliasing simulator features, with the latter reducing moiré. UHD 4K video can be captured at 30p, with 3-axis image stabilization from the IBIS system."
9,
10,
11,
12,
13,
14,"The PENTAX KF is designed to provide outstanding imaging performance in a rugged, highly portable body. It provides dependable, cold-proof performance down to temperatures as low as 14°F (-10°C), performing superbly in a wide range of weather conditions. While considered a mid-range model, the new camera incorporates an array of advanced functions and user-friendly features usually found only in higher-end models including a pentaprism-type optical viewfinder with a nearly 100% field of view and an in-body shake-reduction system with a 4.5-shutter-step compensation."
15,"The Fujifilm X-T5 is our favorite APS-C camera for stills photographers. It's fast, well-designed, and capable of class-leading image quality. However, video quality isn't its strong suit and there are slightly more reliable autofocus systems for the money. Good for: Still photographers, including portrait, wildlife, travel, and landscape shooters. Anyone who desires a rugged, high-resolution camera with classic charm. Not so good for: Videographers and hybrid shooters."
16,"Ideal for advanced amateurs and featuring user-friendly functions, the EOS R6 Mark II camera is a high-performance hybrid camera that’s designed to capture decisive moments in both photo and video formats. It will satisfy a wide range of needs including professional production, vlogging, still pictures, filmmaking, and more. The camera is also well-suited for various photography subjects such as portrait, landscape, sports and wildlife. With the EOS R6 Mark II camera, creativity has virtually no borders. The Canon EOS R6 II stands out even from the very capable crowd of $2000-2500 full-frame cameras. It offers comparable image quality to its peers, competitive autofocus, very good video and the fastest burst shooting in its class. Like a swiss army knife, it's remarkably useful for a range of different things. Good for: a vast range of photo and video tasks. Not so good for: Pro shooting that might benefit from a more specialized camera"
17,"The new Alpha 7R V offers 61.0MP still images plus the most effective 8-step image stabilization system ever offered in any of Sony’s Alpha cameras, as well as refined 8K movie recording, a new 4-axis multi-angle LCD monitor, high-speed communication functions, high-level operability and smooth workflow integration. Sony’s newest camera is ideal for professionals who need a first-class high-resolution imaging tool. The Sony a7R V is a high resolution mirrorless camera, combining an excellent sensor with a powerful autofocus system in a body refined over multiple generations of improvement. It lends itself to a wide range of photography, from portraiture and landscape work to wedding and events. Its cropped, slow readout 8K video is the only real weakspot in an otherwise hugely capable camera. Good for: A broad range of photography requiring high resolution. Not so good for: Work that puts equal emphasis on video and stills."
18,"The OM-5's balance between durability, capability, and portability is hard to match anywhere in the photography world. Although it lacks bleeding-edge performance, for the money this model gives beginners a lot of bang for the buck. It can take great-looking stills, has some of OM System's famed computational photography features, and can shoot good enough video in a pinch, all while snapping away in snow and rain. Good for: Landscapes, vacation snapshots, and vlogging all in inclement weather. Not so good for: High-grade video capture or fast-moving sports."
19,"The ZV-1F is a camera aimed at vloggers and others who want to film themselves. It features vlog-friendly features such as a wide, 20mm equivalent lens, a good microphone with a detachable wind screen, and Sony's 'product showcase' mode, which automatically detects when you're holding an object in front of the camera and focuses on it. Still photographers intrigued by the idea of a compact camera with a wide angle lens for travel or street use take note: the ZV-1F doesn't capture Raw images, so you may want to look elsewhere. Good for: Vlogging, video capture, and social media. Not so good for: Users who need advanced video features or still photographers who want to capture Raw images."
20,"The compact, very accessible FX30 brings up-and-coming visual storytellers into the world of Sony’s highly acclaimed Cinema Line cameras. Drawing on cinematic colour science with S-Cinetone™ and S-Log3 for grading, it produces stunning cinematic imagery while incorporating a full array of workflow-efficient features."
21,"The Fujifilm X-H2 is the brand's first model to make the jump to 40MP, the highest-resolution APS-C sensor to date. Image quality is class-leading, while the build quality and ergonomics are nothing short of pro-level. Full-sensor 8K video is highly-detailed, though quite prone to the effects of rolling shutter, limiting its use to mostly static scenes. And Autofocus performance is generally good, even if there's some room for improvement compared to the competition. Good for: Landscape, studio, and portrait shooters who want the highest possible resolution APS-C camera available. Documentary filmmakers shooting static scenes. Not so good for: Video scenes with movement or panning. Those who don't need 8K video."
22,
23,"The Nikon Z30 is clearly designed with content creators in mind, particularly those intending to film vlogging-style content. It captures 4K/30p video from the full width of the sensor and 1080p video at 120 fps. Lens options are sparse, but it's paired with a respectable 16-50mm (24-70mm equiv) vibration reduction (VR) kit lens that's great for casual run-and-gun shooting. It will work for casual still images, but you're probably better off going with the Z50 for stills photography considering it has an EVF. Good for: Vlogging, streaming and social media content. Not so good for: Advanced video production or stills photographers (you're better off with the Z50, which has an EVF)."
24,"The X-H2S is Fujifilm's most ambitious X-series camera yet, and one of its most adaptable. Its AF system isn't always a match for its most extreme burst speeds but with a little tuning it can deliver impressive hit-rates. The video is also excellent, with features and performance that keep pace with more expensive cameras. It's not cheap but there are few options that can match its performance, for the price. Good for: Action photography, high-end video shooting Not so good for: Photographers who don't need its performance features"
25,
26,"The EOS R10 is perfect for content creators looking to take their creativity to the next level. Featuring a high-speed shooting 15 FPS mechanical shutter1,2, a 24.2 Megapixel CMOS (APS-C) sensor, and lightning fast autofocus, the EOS R10 camera brings some of the best features from the growing EOS R Series to a sleek, lightweight design. Users looking to learn the craft of photography and video, not break the bank in the process and want a no-fuss fun camera to tool around town should give the R10 a serious look, but be aware of the availability (or otherwise) of lenses. Good for: Beginners to intermediates and anyone with interest in casual HDR video Not so good for: Sports photographers or for capturing video intended for editing"
27,"The Lumix GH6 is Panasonic's next-generation video-focused Micro Four Thirds camera. It will use an all-new sensor and image processor, and will be capable of 10-bit 4:2:2 4K/60p capture with no time limit. It can also capture 10-bit 5.7K/60p and 4K/120 footage. It's expected to ship later in 2021. The GH6 is a flexible and dependable video camera that offers all its modes in a wide selection of codecs and bit-rates. The sensor that delivers excellent video falls behind its best stills rivals, making it a less successful hybrid camera than its predecessors, and AF still presents challenges in video. Overall a dependable video production tool that's a pleasure to work with. Good for: Small budget video projects Not so good for: Photographers"
28,"The OM-1 is a new flagship camera released by OM Digital Solutions under its new OM System brand. The OM-1, whose name page homage to the original OM-1 released 50 years ago, features 20.4MP Micro Four Thirds stacked CMOS sensor with 5-axis in-body image stabilization and two high-resolution modes capable of outputting 50MP and 80MP images in a special Tripod High Res mode. It's also quite capable on the video front, with support for 4K video (UHD or DCI) at up to 60 fps and Full HD (1080p) video at up to 240 fps, both internally in H.264 (8-bit) or H.265 (10-bit) codecs. Olympus has also doubled down on its weatherproofing expertise by adding enough weather-sealing to qualify this camera for IP53 dust- and splash-resistance. The OM-1 brings speed, improved AF and more detailed video to a system that already offered great image stabilization and small and light camera/lens combinations. This makes it a powerful all-rounder with particular strengths for wildlife. That compactness comes as a trade-off for absolute image quality but a series of computational multi-shot modes can help close the gap in certain circumstances. It's a lot of capability for the money. Good for: Wildlife, hand-held video, some sports shooting Not so good for: Family photos where simplicity is essential"
29,"The EOS R5 C is a video-orientated variant of Canon's EOS R5. Part of the Cinema EOS range, it shoots 8K at up to 60p in Canon's Cinema Raw Light format, with 10-bit 422 options in the XF-AVC format. The main distinguishing feature is an active cooling system on the back of the camera, allowing unlimited recording times. Unlike the base R5 model, there's no in-body image stabilization system, but there is a socket for syncing timecode. A three-way switch lets you turn the camera on in either Photo or Video mode, with the menus and user interface changing to match the mode you choose. Video mode includes wave form and vectorscope displays not included on the standard R5."
30,"The Leica M11 is a digital rangefinder camera built around a 60MP BSI CMOS sensor. It's the latest in Leica's 'M' series of rangefinders that dates back to the M3 from 1954. With this unrivaled depth of heritage behind it, it's no surprise that the M11 looks a lot like its predecessors. Despite the visual similarities, there's a lot that's changed in the latest model, with a more refined body design as well as completely new internals. The M11 will be available in two variants: a classic silver version with black leatherette band around the center and a brass top-plate, and a black version that uses aluminum instead, making it around 100g lighter. The recommended retail price for both is $8995."
31,"The Nikon Z9 is one of the most powerful cameras on the market, capable of up to 30 fps shooting in JPEG or 20 with Raw capture, and able to record 8K/30 video, with the promise of 12-bit Raw 8K/60 capture in a future firmware update. It's also one of relatively few cameras on the market to completely forego a mechanical shutter, a design decision made possible by the impressively fast read-out speed of the new sensor. The Z9 becomes the first Nikon mirrorless camera to offer the company's 3D Tracking AF system, which can be combined with the camera's machine-learning trained subject recognition system. The autofocus system has been trained to recognize three sets of subjects, covering people, animals and vehicles. In 'Auto' mode the Z9 analyzes the scene to detect subjects automatically, without you having to specify. The Z9 adopts the dual-grip form factor of a D6-level DSLR but shares the slightly more angular look of the existing Z-series cameras. Fully loaded with cards and batteries, the Z9 is around 8% lighter than Nikon's existing D6, and it is around 20% smaller in volume. It has a pull-out 2.1M-dot touchscreen that hinges both vertically and horizontally, for portrait or landscape orientation shooting. The Nikon Z9 is perhaps the most complete camera we've ever tested. It shoots excellent 45MP images at up to 30fps (20 with Raw), it captures 8K video in everything from 8-bit MP4s to 12-bit N-Raw. Its autofocus system is both powerful and easy to use and works well for both stills and video. It's larger and heavier than some of its rivals, which make it less well suited to some applications, but overall it combines the best of a DSLR and a video camera in a single body. Good for: Sports, photojournalism, wedding and events, video Not so good for: Travel photography where size and weight are critical."
32,"The a7 IV is an all-round capable camera, supporting the photographer in almost any situation. Its video capabilities live up to a similar standard, making it a hugely flexible imaging tool. Its extreme levels of customization can be daunting but its powerful autofocus system means it can be a very simple camera to use. Good for: Most photographic or video pursuits Not so good for: Sports photography"
33,"The Panasonic Lumix DC-BS1H is a video-centric full-frame mirrorless camera with a 'box' shape meant to be rigged up for various types of video shooting applications. Sharing a similar design as the DC-BGH1, this camera will be able to capture video at 6K/24p (3:2 aspect ratio), 5.9K/30p (16:9) and 10-bit 4K/60p. It features a V-Log/V-Gamut that can capture around 14 stops of dynamic range which, along with color and skin tones, is virtually the same as the company's professional VariCam. The BS1H has no recording limit for any of its video modes and takes larger Panasonic batteries for extended stamina. In addition to the lenses on Panasonic's L-mount roadmap, EF and PL-mount adapters will allow the use of additional lenses."
34,"The Ricoh GR IIIx is an ultra-compact camera with a 24MP APS-C sensor and 26.1mm (40mm equivalent) F2.8 lens. It has in-body image stabilization, a hybrid autofocus system, built-in neutral density filter, and a fixed touchscreen display (optical and electronic viewfinders are optional). It's capable of capturing Full HD video at 60 fps. Wi-Fi and Bluetooth are also built-in."
35,"The Fujifilm GFX 50S II is a compact 51 Megapixel medium-format (44x33mm) camera that uses the company's GF-mount. It features in-body stabilization with up to 6.5 stops of shake reduction. Photos can be composed on a 3.2"" rear touch screen with a two-axis mechanism or on a large, high resolution EVF.  The 50S II has an updated autofocus system (though it's still contrast-detect), with more accurate face and eye detection. The camera has an OLED info display on its top plate and is highly customizable. The camera can create 205MP images by shifting its sensor, which can reduce false color. The body is weather-sealed against the elements. The GFX 50S II is the least expensive and most refined 50MP medium format camera yet from Fujifilm. Image stabilization boosts the range of circumstances it can be used in, helping it to deliver image quality at the very extreme of what full-frame is capable of. It's not the fastest camera on the market but it can make photography feel special and will deliver the best results this side of Fujifilm's 100MP models if you're shooting the kinds of photos it's strongest at. Good for: Landscape and studio work Not so good for: Sports and social shooting"
36,"The Fujifilm X-T30 II is an update to the original model that boosts performance and provides a higher resolution LCD. It sports a 26.1MP X-Trans sensor and X-Processor 4 Quad Core-CPU. It offers a hybrid AF system with 425 points across the entire frame, with both face and eye detection. It offers a 3"" 1.62M-dot tilting LCD and a 2.36M-dot OLED electronic viewfinder. The camera can capture both DCI and UHD 4K video and high-speed 1080 footage at up to 240 fps."
37,"The Sony ZV-E10 is an E-mount mirrorless camera with a 24MP APS-C sensor. The camera is designed for vlogging and features a fully articulating touchscreen, product showcase feature and soft skin features, a three-capsule microphone, and sockets for an external mic and headphones. It also has Sony's top-notch autofocus system, which tracks eyes and faces with ease. While it can capture 4K video, there's a hefty crop at 30p, but not at 24p. The ZV-E10 can live stream video (using UVC/UAC standards) over its USB-C connection. On the stills side, image quality is very good, bursts can be taken at 11 fps with continuous autofocus and battery life is best-in-class. While it lacks a mode dial, the camera is quite customizable. As a vlogging platform, the ZV-E10 seemingly has a lot to offer: it shoots oversampled 4K/24p video using the full width of its sensor, features a selfie touchscreen, a good built-in directional microphone, headphone/microphone ports and class-leading video autofocus. Battery life is also top of its class and the camera is livestream ready, out of the box. Unfortunately, 4K video capture results in a distracting 'jello effect' for clips with movement and/or fast action. And Full HD video shows poor detail capture compared to the competition. Good for: Vloggers and filmmakers shooting mostly static shots. Not so good for: Any form of vlogging that involves movement or capturing fast action. Stills shooters who want a viewfinder."
38,"The Nikon Z fc is an Z-mount mirrorless camera with a design reminiscent of the company's film cameras, such as the FM2. The top plate is loaded with dials and also has a small screen that displays the current aperture. The Z fc has a hybrid AF system with 209 phase-detect points, along with face and eye detection, for both people and animals. The camera can capture 4K/30p video plus high speed 120 fps footage at Full HD.  The Z fc has a fully articulating 1.04M-dot LCD as well as a 2.36M-dot EVF. It supports USB Power Delivery, which allows the camera to be operated when connected to a laptop charger or power brick. It has a single SD card slot and uses the same EN-EL25 battery as the Z50. The Nikon Z fc is an APS-C mirrorless camera that successfully brings back the design of the company's film cameras. It offers plenty of hands-on controls, a vlogger-friendly fully articulating touchscreen, excellent still and video quality, and plenty of customizability. It could use refinement in a few areas, but for those looking for an eye-catching camera that can capture the moment for social media and more, the Z fc is a solid choice. Good for: Those looking for a light, inexpensive and stylish ILC with direct controls and vlogging-friendly features. Not so good for: Those who prefer a more substantial-feeling body, best-in-class autofocus or a wider selection of native lenses."
39,"The Olympus PEN E-P7 is a rangefinder-style Micro Four Thirds mirrorless camera with a 20MP sensor and 5-axis in-body image stabilization. It has an downward-tilting 3"" touchscreen with 1.04 million dots, but with a flash instead of an electronic viewfinder. It has a 121-point contrast-detect AF system with face and eye detection. The E-P7 has numerous color modes, which can be easily accessed via a switch on its front plate. It can capture 4K/30p video at a bit rate of 102Mbps. Wi-Fi and Bluetooth are built-in. It is sold body-only or kitted with a 14-42mm power zoom lens."
40,"The Panasonic GH5 II (GH5M2) is an updated version of the original that adds new video features, improved autofocus, and a new coating on its 20MP sensor to reduce flare and ghosting. The design and in-body image stabilization are unchanged. New autofocus algorithms allow for faster acquisition, face/eye/body/head detection, and improved tracking. The GH5 II can capture 10-bit 4:2:0 4K/60p footage while simultaneously outputting 10-bit 4:2:2 to an external recorder. Since the camera uses the whole area of the sensor, there is no crop at 4K/60p. The V-Log L gamut is built into the camera, and numerous LUTs for VariCam color profiles can be installed, and two Cinelike gammas are also onboard. The camera supports anamorphic and Full HD 120 fps capture. The camera can also live-stream video over YouTube at up to 1080/60p via a smartphone connection. The GH5 II's body is made of a magnesium alloy body and is weather-sealed and functions down to -10°C/+14°F. It has two SD card slots, both of which support UHS-II speeds. A new battery allows for longer shooting times, and USB PD support lets you power the camera using a laptop charger or portable power device. The GH5 II adds a fewer feature enhancements to one of the strongest stills/video cameras on the market. Autofocus is improved but is still a weak point for 24p video capture, taking the gloss of what's otherwise a superlative video camera. Excellent image stabilization and a broad range of video support tools still make it one of the strongest options for 4K shooting under $3000. Good for: 4K capture in a range of circumstances Not so good for: Run-and-gun shooting relying on autofocus"
41,"The Canon EOS R3 is a high-end full-frame mirrorless designed for sports, wildlife and photojournalism. It's built around Canon's RF mount and uses a 24MP Stacked CMOS sensor and a Digic X processor. The camera has a pro-level design with a built-in grip, and is as rugged as one would expect for its price. Photos can be composed on a 5.76M-dot 'blackout-free' HDR EVF or a high-resolution fully articulating touchscreen. The EVF has an optical viewfinder simulation mode that shows you the scene, rather than the expected output. It's most interesting feature is Eye Control AF, which moves the focus point to the location in the viewfinder that you're looking at. The R3 uses Canon's Dual Pixel AF system and can detect people, animals, and motorsports vehicles, and track them around the frame. The camera can shoot images at 30 fps (even Raw) using its electronic shutter.  Video-wise, the R3 can capture 4K footage produced from a 6K area of the sensor. 4K/120p is also an option, though it is not oversampled. C-Log3 and Raw video can be recorded internally. As one would expect, the camera has mic and headphone sockets, as well as a full-size HDMI port. The R3 has two memory card slots: one for UHS-II SD cards and the other for CFexpress Type B media. In addition to Wi-Fi and Bluetooth, the camera also sports an Ethernet socket for connecting to PCs."
42,"The Sony a7R IV is the company's fourth generation, high-resolution full-frame mirrorless camera and is built around a BSI-CMOS sensor that outputs 60.2MP images. The ""A"" variant of the a7R IV is the same as the original model, but with a higher resolution (2.36M-dot) LCD. Despite its high resolution, it can shoot at up to 10 frames per second with full autofocus and shoot 4K video either from the full width of its sensor or from an APS-C/Super 35 crop. It also gains a 16-shot high-resolution mode that can be used to generate 240MP images of static scenes. The a7R IV has in-body image stabilization that's usable for still and video shooting. It has a top-notch autofocus system with face and eye detection that sticks to the subject, even if they look away or are momentarily blocked. It has a large, ultra-high-res electronic viewfinder, tilting touchscreen display and dual UHS-II SD card slots. The camera body is sealed against dust and moisture."
